Titulo,Nombre del Canal,Subcriptores,Vistas Totales,Numero de Comentarios
📊 ESTRATEGIA QUOTEX OTC: SECRETOS PARA MAXIMIZAR TUS GANANCIAS | Mejor Estrategia Trading | Quotex,Trader Jesus,27100,3964,656
Todas Las Estrategias De Trading Explicadas En 15 Minutos,Alex Ruiz,296000,47782,129
Las 2 Mejores Estrategias De Trading Para Empezar En 2024,Alex Ruiz,296000,182750,283
Tier List De Las Mejores Estrategias De Trading Para Principiantes,Alex Ruiz,296000,34249,192
3 ESTRATEGIAS de TRADING para SER RENTABLE y GANAR SIEMPRE,Master Traders,122000,68727,209
Gano 3000$US al día con esta estrategia de Trading,El Sensei,772000,140787,536
Así se USAN las 2 ESTRATEGIAS de TRADING mas RENTABLES,Master Traders,122000,35509,286
La Mejor Estrategia De Trading Si Tienes Otro Trabajo,Alex Ruiz,296000,144579,616
LAS MEJORES Estrategias para PREDECIR LAS VELAS en OPCIONES BINARIAS,Full Trading Top,4370,337,11
"Deja de Buscar ESTRATEGIAS de TRADING , Mejor HAZ ESTO",Master Traders,122000,134350,267
"LA ESTRATEGIA QUE ME DIO $120,000 USD EN ENERO",El Sensei,772000,590823,1534
Revelada La Estrategia Del Campeón Del Mundo De Trading,Alex Ruiz,296000,95554,322
Así se USA la MEJOR ESTRATEGIA de TRADING que EXISTE ( Fibonacci ),Master Traders,122000,146525,318
Revelada La Estrategia Del Mejor Trader De Japón,Alex Ruiz,296000,472993,587
TRADING con LINEAS de TENDENCIA 〽️ MEJORES ESTRATEGIAS 💥💥💥,Matemática Del Trading,30100,88667,271
La Estrategia De Trading Que Te Hace Rentable En 2 Semanas,Alex Ruiz,296000,262186,2032
Esta Es La Mejor Estrategia De Trading Con RSI,Alex Ruiz,296000,30745,78
Compruebo Si La Estrategia Del Mejor Trader Del Mundo Es Rentable,Alex Ruiz,296000,113891,215
💸He ENCONTRADO la MEJOR ESTRATEGIA DE TRADING??? 💸 - [Trading desde 0],DollarDorado,627000,436327,827
La MEJOR ESTRATEGIA de TRADING Para PRINCIPIANTES⛔ - [Joven Inversor],Joven Inversor,755000,130062,409
Analizo El Código De Una De Las Mejores Estrategias De Trading,Alex Ruiz,296000,113230,179
Compruebo Si La Mejor Estrategia De Trading De ICT Funciona,Alex Ruiz,296000,93659,678
"NO MAS ESTRATEGIAS de TRADING , Mejor HAZ ESTO",Master Traders,122000,20478,164
la MEJOR ESTRATEGIA de TRADING SWING TRADING | SMART MONEY para SWING TRADERS,BELIKETHEALGO,37600,22199,133
Estrategia De Trading En Scalping Para Principiantes,Alex Ruiz,296000,200069,240
Esta Es La Mejor Estrategia De Trading Con Medias Móviles,Alex Ruiz,296000,42862,331
Las 2 MEJORES Estrategias para Opciones Binarias,Master Traders,122000,15417,235
Heikin Ashi | La Estrategia De Trading Definitiva,Alex Ruiz,296000,163952,268
La Mejor Estrategia De Trading Con MACD (% De Acierto Alto),Alex Ruiz,296000,24831,85
La Estrategia Del Mejor Trader De La Historia,Alex Ruiz,296000,40158,95
La MEJOR ESTRATEGIA de TRADING que EXISTE ( Fibonacci + Order Blocks ),Master Traders,122000,14025,71
Mi ESTRATEGIA de TRADING en 4 MINUTOS | FOREX INSTITUCIONAL ( TRADING en VIVO ) | SMART MONEY,BELIKETHEALGO,37600,32788,107
⛔LA MEJOR ESTRATEGIA para PRINCIPIANTES [Mini Curso de Trading],Nexsson Trading,266000,495114,557
la MEJOR ESTRATEGIA de TRADING | SMART MONEY | 100% RENTABLE | MUY AVANZADO,BELIKETHEALGO,37600,37990,201
Esta Estrategia De Trading No Es Divertida Pero Es Rentable,Alex Ruiz,296000,131358,426
La ESTRATEGIA de TRADING mas SIMPLE y EFECTIVA para PRINCIPIANTES,Master Traders,122000,31748,161
El Day Trading No Funcionaba Hasta Que Entendí Este Método,Alex Ruiz,296000,103330,295
Estrategia de Trading para Ganar $150/Día en 2024,El Sensei,772000,84395,200
NO FALLES MAS en el TRADING ( Entiende ESTO y GANA ),Master Traders,122000,153468,412
Revelada La Estrategia De Trading Del Mejor Trader De Suecia,Alex Ruiz,296000,64902,67
Te REVELO la ESTRATEGIA de TRADING AVANZADA con FIBONACCI,Master Traders,122000,25757,254
Las Mejores Medias Móviles Para Hacer Trading,Alex Ruiz,296000,50505,239
Esta es la ESTRATEGIA de Swingtrading que MÁS DINERO me ha dado,El psicólogo del trading,141000,70689,137
Los 3 PASOS para ANALIZAR tus GRAFICOS y GANAR en el TRADING,Master Traders,122000,109260,244
Estrategia para SCALPING con 2 INDICADORES 🔥 [Trading para Principiantes],Inverarg: Invertir en Argentina,435000,56491,81
"Ser Rentable en Trading Es Difícil, Hasta que Usas Esta Estrategia",El Sensei,772000,148279,439
Una ESTRATEGIA de TRADING para ser RENTABLE ( Cruce de Medias Móviles ),Master Traders,122000,25341,218
La ESTRATEGIA de TRADING más EFECTIVA ( Order Blocks ),Master Traders,122000,30397,104
El SECRETO para GANAR SIEMPRE en el TRADING ( Comprar o Vender ),Master Traders,122000,188121,439
