Titulo,Nombre del Canal,Subcriptores,Vistas Totales,Numero de Comentarios,Direccion,Ratio
La MEJOR ESTRATEGIA para operar el ORO [XAUUSD],YOSOYUNTRADERGANADOR,13000,24502,78,https://www.youtube.com/watch?v=aSD5wVaa7NY,53087666666.66667
ESTRATEGIA CON EL ORO GANADORA INCLUSO EN LAS CRISIS 💪 | Backtesteada Durante 4 Años (XAU/USD),Trading Studio,13300,27476,45,https://www.youtube.com/watch?v=Kq80CzB1ZvU,108005103111.11111
✅Estrategia para operar con el ORO (XAUUSD) 2023 en Forex I Trading institucional,Santiago Trader,4350,23030,73,https://www.youtube.com/watch?v=OOgY2iLRI3Y,5969659931.506849
Estrategia para tomar entradas en 5m en el XAUUSD,David Meza Trading,1170,683,12,https://www.youtube.com/watch?v=Z3Lla2nCfO0,77913225.0
COMO analizar en ORO XAUUSD en 3 simples pasos ESTRATEGIA GANADORA,YOSOYUNTRADERGANADOR,13000,6065,45,https://www.youtube.com/watch?v=Dy2aOGIDMBQ,22777444444.444443
la MEJOR FORMA para OPERAR el XAUUSD (ORO) en FOREX | las ZONAS del XAUUSD,HOTMARKETGUY,6460,6352,17,https://www.youtube.com/watch?v=hN0oyuPEAaE,15592889600.0
"Deja de Buscar ESTRATEGIAS de TRADING , Mejor HAZ ESTO",Master Traders,124000,135460,268,https://www.youtube.com/watch?v=5W-H5xsE4mA,7771764776119.402
Estrategia Completa de XAUUSD al detalle,Enigmatic Trading,14600,22192,93,https://www.youtube.com/watch?v=BfYTQKwte6A,50865018494.62366
&quot;Operando Brillantemente: Descubre mi Estrategia Ganadora en XAUUSD&quot; #trading #forex,Fx Neptune,3170,37,0,https://www.youtube.com/watch?v=ZmPt-ynLyQA,inf
"ESTRATEGIA PARA XAUUSD, APRENDERAS A OPERAR EL ORO FACIL Y EFECTIVA.",DR.TRADER,2440,7130,55,https://www.youtube.com/watch?v=ba1Wphsy7ec,771803054.5454544
ESTRATEGIA PARA XAUUSD 2022 - FACIL Y EFECTIVA,Lesther Day Trader,13200,830,4,https://www.youtube.com/watch?v=Sm-3Ncd_zVo,36154800000.0
Estrategia Institucional XAUUSD,Johan Rincon Fx,7880,10647,50,https://www.youtube.com/watch?v=HWbY35DHIlc,13222381535.999998
Estrategia para operar GOLD XAUUSD paso a paso 2024,kathcastello,1630,290,4,https://www.youtube.com/watch?v=I76vVlXto8Q,192625250.0
Estrategia Explosiva para el ORO (XAUUSD),Coinducation,644,2247,4,https://www.youtube.com/watch?v=RQQ51jZz3qA,232977947.99999997
&quot;Operando Fortunas: Desvelando mi Estrategia Ganadora en XAUUSD&quot; #trading #forex #clasedetrading,Fx Neptune,3170,15,0,https://www.youtube.com/watch?v=9r9cUJNFFrE,inf
cómo GANAR ENTRADAS en XAUUSD | Estrategia para XAUUSD FIBONACCI SMART MONEY CONCEPTS,HOTMARKETGUY,6460,870,1,https://www.youtube.com/watch?v=VbzryViESC0,36306492000.0
"Trader, deja de perder en XAUUSD.",00XAU,4480,6360,47,https://www.youtube.com/watch?v=PWl30ZLvm8k,2715909446.808511
Como OPERAR EL ORO Y NO PERDER DINERO [Xauusd] | ALEXOSORIO,El Mentor,24700,20818,68,https://www.youtube.com/watch?v=FPpVuIjDBpc,186777259117.64703
La mejor ESTRATEGIA para hacer trading en ORO | Estrategias de Trading,Vida Emprendedora,134000,28213,28,https://www.youtube.com/watch?v=fuk6BmAW2s0,18092593857142.86
"LA ESTRATEGIA QUE ME DIO $120,000 USD EN ENERO",El Sensei,776000,591453,1536,https://www.youtube.com/watch?v=jpzRaYM6cgM,231874219875000.0
Estrategia De Trading En Scalping Para Principiantes,Alex Ruiz,298000,201653,240,https://www.youtube.com/watch?v=omEXiOg5F4o,74614970883333.33
Aprende la Estrategia Secreta para Operar el XAUUSD / Entrada en vivo del Oro (Xauusd),Danni Casares,3360,3023,92,https://www.youtube.com/watch?v=7jayQNLB9yk,370961530.4347826
&quot;Oro Brillante: Mi Estrategia Ganadora en XAUUSD&quot; #trading #forex #educaciondetrading,Fx Neptune,3170,51,0,https://www.youtube.com/watch?v=VOc2jMqRE2Y,inf
Live XAUUSD GOLD- My Trading Strategy-11/10,FOREX & GOLD,145000,9337,0,https://www.youtube.com/watch?v=eCkiIoJwCOg,inf
Así se USA la MEJOR ESTRATEGIA de TRADING que EXISTE ( Fibonacci ),Master Traders,124000,147580,318,https://www.youtube.com/watch?v=CyBzabXTtQA,7135817861635.221
600 usd en XAUUSD ESTRATEGIA OFERTA Y DEMANDA #forex #xauusd #estrategiaforex #criptomonedas,Dem Cripto,139,1894,0,https://www.youtube.com/watch?v=3XPe11SqA5E,inf
ESTRATEGIA de TRADING con ACCION DEL PRECIO para el ORO PROBADA 100 VECES👑 - ¡DEMASIADO FACIL!,Jack ́s Backtest - Estrategias de Trading,8340,3287,18,https://www.youtube.com/watch?v=saBf7CJFNfU,12701625400.0
🤑 Estrategia GANADORA de Trading Scalping de 1 Minuto (+96% Winrate),Trading con Dinero Fácil,49400,258281,616,https://www.youtube.com/watch?v=_22oCPoGqFk,1023212047337.6624
Las 2 Mejores Estrategias De Trading Para Empezar En 2024,Alex Ruiz,298000,183451,284,https://www.youtube.com/watch?v=PtQXzCit-K8,57363319028169.01
RR 1:65 CON 4 ENTRADAS PERFECTAS EN UNA MAÑANA EN EL ORO [XAUUSD] | ANALISIS DESDE CERO,It's Smart Money,111000,43237,453,https://www.youtube.com/watch?v=tJ2b-jadXaM,1175989132450.3313
✅ ¿Cómo analizar el ORO? I XAUUSD I Trading institucional,Santiago Trader,4350,6206,13,https://www.youtube.com/watch?v=WmvnP89Q_gM,9033310384.615385
Revelada a Estratégia Secreta no XAUUSD - FOREX,SOS InterForex,3160,10178,14,https://www.youtube.com/watch?v=6SMPfL2EFjs,7259531200.0
✅ Cómo tomar entradas en el ORO (XAUUSD) 2023 en Forex I Trading institucional,Santiago Trader,4350,7085,28,https://www.youtube.com/watch?v=kGD9ac9Khxc,4788068303.571428
MEGA ESTRATEGIA PARA EL ORO - SCALPING (IDEAL PARA PRINCIPIANTES),JP Capitals,1820,1398,8,https://www.youtube.com/watch?v=HYIMFCuVQ_8,578841899.9999999
Estrategia de Scalping en 1 minuto para operar el oro -XAUUSD,Ice Tradingt,4420,1390,0,https://www.youtube.com/watch?v=jojbxO45jiM,inf
CAPACITACIÓN 3 | ESTRATEGIA OO FOREX GOLD XAUUSD,Lore Rodríguez #GoldGirl,332,1756,28,https://www.youtube.com/watch?v=GEp-lJumD04,6912619.428571429
Estrategia Day Trading 2024 ICT x SMC en ORO (XAUUSD),Gustavom.Trader,1890,741,4,https://www.youtube.com/watch?v=jGa496bAnn8,661731524.9999999
🤑 Este Indicador es Impresionante GANA más del 90% de Trades en 5 Minutos,Trading con Dinero Fácil,49400,38447,23,https://www.youtube.com/watch?v=R_nDp_55o28,4079326996521.7393
How To Trade Gold (XAU/USD) In 2024 #trading #trader #forex #xauusd #gold,Words of Rizdom,237000,21854,18,https://www.youtube.com/watch?v=JAgP1f1wH0o,68195406999999.99
¡CUIDADO ⛔ INDICADOR EXTREMADAMENTE PRECISO! ¿Es El Mejor Indicador De Trading? [LO COMPROBAMOS],Trading Studio,13300,145696,360,https://www.youtube.com/watch?v=YgWNvlXuULU,71589348444.44444
Estrategia  Para Pasar Cuentas de Fondeo / #xauusd,TRADING WEB HOUSE,8270,12544,697,https://www.youtube.com/watch?v=ivBM9PKlstE,1230875950.6456244
🤑 La ESTRATEGIA más POTENTE de SCALPING en 2023 es PERFECTA para GANAR Mucho DINERO #scalping,Trading con Dinero Fácil,49400,31171,52,https://www.youtube.com/watch?v=6yexw8dZLZ0,1462855030000.0
"How to Trade XAU/USD: Best Gold Trading Strategy? (11 MAR,2022) #short #xauusd #gold",DayTrading,1410,41084,8,https://www.youtube.com/watch?v=KWHHfz-Nj9o,10209887550.0
#forex #live #trade #gold #xauusd #livetrading,TradeHubFX,4860,37916,26,https://www.youtube.com/watch?v=rfoeC_-N4AU,34444644369.230774
"Cómo Ganar en XAUUSD, Aprende Cómo Operar el Oro💥 - (Explicado) - Trading Estrategia",AprendeCazando,2060,9056,12,https://www.youtube.com/watch?v=3s0mIYV3hro,3202503466.6666665
"#xauusd shorts 59,000 USD Fakeout",Raja Banks,316000,109577,63,https://www.youtube.com/watch?v=S8WjZPdyzTc,173681284317460.34
Riding XAUUSD trend | Trend is our friend #xauusd #gold #trading #forex #shorts,Trade Track,8580,1478,5,https://www.youtube.com/watch?v=opMTp3CS6Iw,21761007840.0
✅Como operar el ORO ? I Estrategia para el ORO I Curso para el oro Clase #8,Santiago Trader,4350,2459,18,https://www.youtube.com/watch?v=61uxSLWr3oE,2585023750.0
Estrategia ORO (XAUUSD),Trading School,3580,2080,14,https://www.youtube.com/watch?v=shs3V87cmbY,1904150857.142857
Estrategia Simples e Lucrativa para Operar no OURO   XAUUSD  GOLD,ForexBR,3090,1144,13,https://www.youtube.com/watch?v=WOddVV7VsTc,840232800.0
