Titulo,Nombre del Canal,Subcriptores,Vistas Totales,Numero de Comentarios,Direccion,Ratio
ESTRATEGIA CON EL ORO GANADORA INCLUSO EN LAS CRISIS 💪 | Backtesteada Durante 4 Años (XAU/USD),Trading Studio,13300,27476,45,https://www.youtube.com/watch?v=Kq80CzB1ZvU,108005103111.11111
La MEJOR ESTRATEGIA para operar el ORO [XAUUSD],YOSOYUNTRADERGANADOR,13000,24502,78,https://www.youtube.com/watch?v=aSD5wVaa7NY,53087666666.66667
La mejor ESTRATEGIA para hacer trading en ORO | Estrategias de Trading,Vida Emprendedora,134000,28213,28,https://www.youtube.com/watch?v=fuk6BmAW2s0,18092593857142.86
✅Estrategia para operar con el ORO (XAUUSD) 2023 en Forex I Trading institucional,Santiago Trader,4350,23030,73,https://www.youtube.com/watch?v=OOgY2iLRI3Y,5969659931.506849
Estrategia De Trading En Scalping Para Principiantes,Alex Ruiz,298000,201653,240,https://www.youtube.com/watch?v=omEXiOg5F4o,74614970883333.33
Las 2 Mejores Estrategias De Trading Para Empezar En 2024,Alex Ruiz,298000,183451,284,https://www.youtube.com/watch?v=PtQXzCit-K8,57363319028169.01
COMO analizar en ORO XAUUSD en 3 simples pasos ESTRATEGIA GANADORA,YOSOYUNTRADERGANADOR,13000,6065,45,https://www.youtube.com/watch?v=Dy2aOGIDMBQ,22777444444.444443
Sistema de Trading para Indices y Oro Rentable y Simple,Estrategias Ganadoras de Trading,2470,1298,10,https://www.youtube.com/watch?v=hUK7PyuPZrQ,791896820.0000002
Estrategia N° 14: Swing Trading con RSI 2 de Larry Connors - Guía Completa,Job Vargas Trader,3550,8,0,https://www.youtube.com/watch?v=3j_p790lKmY,inf
"LA ESTRATEGIA QUE ME DIO $120,000 USD EN ENERO",El Sensei,776000,591453,1536,https://www.youtube.com/watch?v=jpzRaYM6cgM,231874219875000.0
"Deja de Buscar ESTRATEGIAS de TRADING , Mejor HAZ ESTO",Master Traders,124000,135460,268,https://www.youtube.com/watch?v=5W-H5xsE4mA,7771764776119.402
💥Estrategias claves para operar el Oro y la Plata✨,FX TRADING INVEST,5340,746,8,https://www.youtube.com/watch?v=JbD2puM5ih4,2659079700.0
Mi Estrategia SECRETA de Rupturas de Líneas de Tendencia #shorts #trading,Alexflamas,120000,383228,343,https://www.youtube.com/watch?v=OGMDBdbDVlo,16088872303206.998
"ESTRATEGIA PARA XAUUSD, APRENDERAS A OPERAR EL ORO FACIL Y EFECTIVA.",DR.TRADER,2440,7130,55,https://www.youtube.com/watch?v=ba1Wphsy7ec,771803054.5454544
ESTRATEGIA de TRADING con ACCION DEL PRECIO para el ORO PROBADA 100 VECES👑 - ¡DEMASIADO FACIL!,Jack ́s Backtest - Estrategias de Trading,8340,3287,18,https://www.youtube.com/watch?v=saBf7CJFNfU,12701625400.0
Estrategia Completa de XAUUSD al detalle,Enigmatic Trading,14600,22192,93,https://www.youtube.com/watch?v=BfYTQKwte6A,50865018494.62366
Cómo Ganar Dinero en Trading de Oro ➤ Estrategia Paso a Paso,ZCoinTV,27300,4108,137,https://www.youtube.com/watch?v=go_Kc9itkTQ,22347819854.0146
Estrategia GANADORA en TRADING ¡Increíble!,Mauro Frias,41000,9726,9,https://www.youtube.com/watch?v=8cWr4mWXhrQ,1816600666666.6667
Análisis Trading Forex - Trading en ORO + 900 Dólares,BURS ADVISORY,175000,4545,9,https://www.youtube.com/watch?v=Rq9_aeEGdUg,15465624999999.998
Estrategia de Scalping en Trading probada 100 Veces **80% Win Rate** #shorts,Alexflamas,120000,164378,147,https://www.youtube.com/watch?v=8B6mFwfMvig,16102334693877.55
la MEJOR FORMA para OPERAR el XAUUSD (ORO) en FOREX | las ZONAS del XAUUSD,HOTMARKETGUY,6460,6352,17,https://www.youtube.com/watch?v=hN0oyuPEAaE,15592889600.0
La Estrategia De Trading Que Te Hace Rentable En 2 Semanas,Alex Ruiz,298000,263526,2037,https://www.youtube.com/watch?v=X9edzFqmUyk,11488543399116.346
Estrategia ORO 4H || Forex || 2024 || Trading Rentable,Todos Somos Traders,3450,235,0,https://www.youtube.com/watch?v=vov1lBCJYs8,inf
Conseguí Ser Rentable Con Esta Estrategia De Trading,Alex Ruiz,298000,78924,191,https://www.youtube.com/watch?v=o5i0yWkYfuI,36695114638743.45
✅Como operar el ORO ? I Estrategia para el ORO I Curso para el oro Clase #1,Santiago Trader,4350,4422,64,https://www.youtube.com/watch?v=UFOlzBL44Dw,1307426484.3750002
ESTRATEGIA DE TRADING PARA OPERAR CON ORO 💰,Libertex Partner de Libertad Academy,11900,13079,15,https://www.youtube.com/watch?v=S6xS0JKwA0Y,123474479333.33333
Scalping de Oro: ¿Rentable o Arriesgado? Descubre la Verdad y Estrategia Ganadora parte 1.,Todos Somos Traders,3450,45,0,https://www.youtube.com/watch?v=wz2wzhQDrHo,inf
CAPACITACIÓN 3 | ESTRATEGIA OO FOREX GOLD XAUUSD,Lore Rodríguez #GoldGirl,332,1756,28,https://www.youtube.com/watch?v=GEp-lJumD04,6912619.428571429
"Un trader me muestra una estrategia que acierta el 99,5% de las veces",El psicólogo del trading,141000,398592,717,https://www.youtube.com/watch?v=qKb4-ZfuaYk,11052172317991.63
"ESTRATEGIA GANADORA de trading para Bitcoin 2022,SP500,Oro,MSCI + Indicador gratis Tradingview",Trading Strategy,524,267,7,https://www.youtube.com/watch?v=dl9z5kR_Lhk,10473113.142857144
ESTRATEGIA para ORO con alta EFECTIVIDAD  I  Trading Institucional,Fernanda Quirama,1660,3940,30,https://www.youtube.com/watch?v=lsUDVW2-gBk,361902133.3333333
El ORO está en MÁXIMOS HISTORICOS ⭐,Pablo Gil Trader,280000,5211,5,https://www.youtube.com/watch?v=9Qnt8N-JsIA,81708480000000.0
✅Estrategia para operar el ORO en forex  I Curso para el oro Clase #7,Santiago Trader,4350,1607,30,https://www.youtube.com/watch?v=IH94_DSQ_zY,1013615250.0000001
Revelada La Estrategia Del Campeón Del Mundo De Trading,Alex Ruiz,298000,95970,318,https://www.youtube.com/watch?v=FtNZfP7eHAQ,26800376981132.074
Cómo Ganar Dinero Haciendo Scalping - Estrategia de Scalping Rentable para el Oro en Forex,Ice Tradingt,4420,1357,4,https://www.youtube.com/watch?v=PkNx4q7by-E,6627723700.0
Scalping de Oro: ¿Rentable o Arriesgado? Descubre la Verdad y Estrategia Ganadora parte 2.,Todos Somos Traders,3450,63,0,https://www.youtube.com/watch?v=Kxj728q45lQ,inf
5 Reglas de Oro que Me Hicieron MILLONARIO con el Trading,El Sensei,776000,250936,1019,https://www.youtube.com/watch?v=gCOZ0A_4238,148290124372914.62
✅¿Cual es la mejor forma de analizar el ORO en trading? -Analisis en vivo ORO Forex,Santiago Trader,4350,3346,22,https://www.youtube.com/watch?v=rByUaJRpBXc,2877940227.272728
&quot;Oro Brillante: Mi Estrategia Ganadora en XAUUSD&quot; #trading #forex #educaciondetrading,Fx Neptune,3170,51,0,https://www.youtube.com/watch?v=VOc2jMqRE2Y,inf
Así se USA la MEJOR ESTRATEGIA de TRADING que EXISTE ( Fibonacci ),Master Traders,124000,147580,318,https://www.youtube.com/watch?v=CyBzabXTtQA,7135817861635.221
Trading en Oro por Rubén J. Ullúa en Estrategias Tv (06.07.16),Estrategias de inversión,152000,471,0,https://www.youtube.com/watch?v=c8cc3RkHYK0,inf
Todo Lo Que Necesitas Saber Sobre El ORO |  Análisis de Mercado por Pablo Gil,Pablo Gil Trader,280000,90729,338,https://www.youtube.com/watch?v=1aIF7z0nAd8,21044833136094.676
Estrategia para operar el ORO 2024 I Trading I Santiago Trader,Santiago Trader,4350,3017,6,https://www.youtube.com/watch?v=RqVJHiL8kLg,9514863750.0
🔥 OPERACIÓN GANADORA CON LA ESTRATEGIA DE TRAMPAS DE CÓDIGO TRADING 🔥 #short #shorts,Código Trading,142000,944,1,https://www.youtube.com/watch?v=a0mfcbMPtWA,19034816000000.0
Estrategia de Trading en el Oro dólar: líneas de Tendencia y Ruptura lateral,ESPECTRO XAUUSD,309,2437,15,https://www.youtube.com/watch?v=NssjW2koQ24,15512479.8
¿El ORO Subirá?🪙,Pablo Gil Trader,280000,15684,14,https://www.youtube.com/watch?v=atknrYqFqR0,87830400000000.02
Explicando Mi Nueva Estrategia De Trading Para Operar El Oro,Tradingconpablo,8590,2899,17,https://www.youtube.com/watch?v=cXAd1ijDixk,12583041288.235294
🤐 Estrategia FOREX RENTABLE en 5 minutos 👉 PARA PRINCIPIANTES (79% WINRATE),Gerard Garcia,20400,31053,129,https://www.youtube.com/watch?v=OQRaszbCxF4,100178422325.5814
Una estrategia para invertir en el Oro y Petróleo,Admirals Latinoamérica,10800,8416,7,https://www.youtube.com/watch?v=vzT4QqZGkvo,140234605714.28574
