Titulo,Nombre del Canal,Subcriptores,Vistas Totales,Numero de Comentarios,Direccion,Ratio
la MEJOR ESTRATEGIA para OPERAR el ORO de FORMA CORRECTA | NO pierdas MS ENTRADAS!,HOTMARKETGUY,6440,3642,53,https://www.youtube.com/watch?v=-pBkm8aHESY,2849940588.6792455
Como operar el ORO ? I Estrategia para el ORO I Curso para el oro Clase #1,Santiago Trader,4290,4320,64,https://www.youtube.com/watch?v=UFOlzBL44Dw,1242276750.0
Todo Lo Que Necesitas Saber Sobre El ORO | An谩lisis de Mercado por Pablo Gil,Pablo Gil Trader,279000,90438,338,https://www.youtube.com/watch?v=1aIF7z0nAd8,20827764372781.066
La MEJOR ESTRATEGIA para operar el ORO [XAUUSD],YOSOYUNTRADERGANADOR,12900,24130,77,https://www.youtube.com/watch?v=aSD5wVaa7NY,52149003896.1039
la MEJOR FORMA para OPERAR el XAUUSD (ORO) en FOREX | las ZONAS del XAUUSD,HOTMARKETGUY,6440,6196,17,https://www.youtube.com/watch?v=hN0oyuPEAaE,15115907388.235294
ESTRATEGIA CON EL ORO GANADORA INCLUSO EN LAS CRISIS  | Backtesteada Durante 4 A帽os (XAU/USD),Trading Studio,13200,27227,45,https://www.youtube.com/watch?v=Kq80CzB1ZvU,105422944000.00003
Las 2 Mejores Estrategias De Trading Para Empezar En 2024,Alex Ruiz,297000,182867,284,https://www.youtube.com/watch?v=PtQXzCit-K8,56797588742957.75
Consegu铆 Ser Rentable Con Esta Estrategia De Trading,Alex Ruiz,297000,78705,191,https://www.youtube.com/watch?v=o5i0yWkYfuI,36348111753926.7
Como pagar menos impuestos a trav茅s de soluciones financieras,Rankia LIVE,14700,386,1,https://www.youtube.com/watch?v=Vh0SB_Z0F58,83410740000.0
Estrategia Completa de XAUUSD al detalle,Enigmatic Trading,14600,22054,93,https://www.youtube.com/watch?v=BfYTQKwte6A,50548716559.139786
ESTRATEGIA DE TRADING PARA OPERAR CON ORO ,Libertex Partner de Libertad Academy,11900,13046,15,https://www.youtube.com/watch?v=S6xS0JKwA0Y,123162937333.33333
Como hacer SCALPING para GANAR en el ORO ( INCREIBLE ),Master Traders,122000,5271,55,https://www.youtube.com/watch?v=NKjMdbkjdyY,1426428436363.6365
La mejor ESTRATEGIA para hacer trading en ORO | Estrategias de Trading,Vida Emprendedora,134000,28176,28,https://www.youtube.com/watch?v=fuk6BmAW2s0,18068866285714.285
Estrategia para operar con el ORO (XAUUSD) 2023 en Forex I Trading institucional,Santiago Trader,4290,22909,73,https://www.youtube.com/watch?v=OOgY2iLRI3Y,5775609957.534246
ESTRATEGIA de TRADING con ACCION DEL PRECIO para el ORO PROBADA 100 VECES - 隆DEMASIADO FACIL!,Jack s Backtest - Estrategias de Trading,8330,3276,18,https://www.youtube.com/watch?v=saBf7CJFNfU,12628779800.0
La Estrategia De Trading Definitiva Con Medias M贸viles,Alex Ruiz,297000,81414,337,https://www.youtube.com/watch?v=JTraH1-aFRM,21309933311572.7
Estrategia De Trading En Scalping Para Principiantes,Alex Ruiz,297000,200322,240,https://www.youtube.com/watch?v=omEXiOg5F4o,73625847075000.0
"LA ESTRATEGIA QUE ME DIO $120,000 USD EN ENERO",El Sensei,773000,590962,1536,https://www.youtube.com/watch?v=jpzRaYM6cgM,229893836522135.44
驴Cual es la mejor forma de analizar el ORO en trading? -Analisis en vivo ORO Forex,Santiago Trader,4290,3333,22,https://www.youtube.com/watch?v=rByUaJRpBXc,2788221150.0
"ESTRATEGIA PARA XAUUSD, APRENDERAS A OPERAR EL ORO FACIL Y EFECTIVA.",DR.TRADER,2430,7099,53,https://www.youtube.com/watch?v=ba1Wphsy7ec,790922360.3773586
4 Reglas de oro para INVERTIR con 茅xito,Aprendiz Financiero,1530000,297380,171,https://www.youtube.com/watch?v=7t5iWCVcqB8,4070975684210526.5
La Mejor Estrategia De Trading Si Tienes Otro Trabajo,Alex Ruiz,297000,144795,616,https://www.youtube.com/watch?v=nvJEM3HhJzk,20734126875000.0
Estrategia para operar el ORO en forex  I Curso para el oro Clase #7,Santiago Trader,4290,1575,30,https://www.youtube.com/watch?v=IH94_DSQ_zY,966215250.0
"Deja de Buscar ESTRATEGIAS de TRADING , Mejor HAZ ESTO",Master Traders,122000,134525,267,https://www.youtube.com/watch?v=5W-H5xsE4mA,7499138951310.861
Esta es la ESTRATEGIA de Swingtrading que MS DINERO me ha dado,El psic贸logo del trading,141000,70717,137,https://www.youtube.com/watch?v=jVbEOKRZGPg,10262223919708.03
Especial T茅cnicas #SCALPING: #ORO,Invertir en Valor  - Trading en Espa帽ol,31000,6131,33,https://www.youtube.com/watch?v=lVVmX9fG9pQ,178542151515.15152
Esta es la MEJOR Estrategia para Acumular Oro y Plata en el 2024,MONEDAS DEL MUNDO,3120,3115,19,https://www.youtube.com/watch?v=w1W4b4RcyYc,1595929263.1578946
La Estrategia De Trading Que Te Hace Rentable En 2 Semanas,Alex Ruiz,297000,262385,2032,https://www.youtube.com/watch?v=X9edzFqmUyk,11390117354822.836
Estrategia de trading forex en tokio,BURS ADVISORY,175000,34732,459,https://www.youtube.com/watch?v=Iot3_Ct6nLw,2317358387799.564
Como OPERAR EL ORO Y NO PERDER DINERO [Xauusd] | ALEXOSORIO,El Mentor,24700,20792,68,https://www.youtube.com/watch?v=FPpVuIjDBpc,186543989411.7647
Estrategia de Order Blocks | Entradas precisas Trading Forex,BURS ADVISORY,175000,59378,386,https://www.youtube.com/watch?v=ffVbKXk2-g0,4711013601036.27
Estrategia Institucional XAUUSD,Johan Rincon Fx,7740,10569,50,https://www.youtube.com/watch?v=HWbY35DHIlc,12663268488.0
CURSO de TRADING - Como USAR FIBONACCI para GANAR FACILMENTE,Master Traders,122000,56645,233,https://www.youtube.com/watch?v=ZlsEjhCXwws,3618472875536.4805
Estrategia para operar el ORO 2024 I Trading I Santiago Trader,Santiago Trader,4290,2991,6,https://www.youtube.com/watch?v=RqVJHiL8kLg,9174443850.0
C贸mo Ganar Dinero Haciendo Scalping - Estrategia de Scalping Rentable para el Oro en Forex,Ice Tradingt,4420,1348,4,https://www.youtube.com/watch?v=PkNx4q7by-E,6583766799.999999
RR 1:65 CON 4 ENTRADAS PERFECTAS EN UNA MAANA EN EL ORO [XAUUSD] | ANALISIS DESDE CERO,It's Smart Money,111000,43167,453,https://www.youtube.com/watch?v=tJ2b-jadXaM,1174085225165.563
Estrategia para SCALPING con 2 INDICADORES  [Trading para Principiantes],Inverarg: Invertir en Argentina,436000,56579,83,https://www.youtube.com/watch?v=1xwpv-fyCPk,129583633542168.67
As铆 GANO SIEMPRE en el TRADING usando la ESTRATEGIA FIBONACCI,Master Traders,122000,50679,231,https://www.youtube.com/watch?v=2ahtIgVfnv0,3265394961038.961
Analizo El C贸digo De Una De Las Mejores Estrategias De Trading,Alex Ruiz,297000,113332,179,https://www.youtube.com/watch?v=vpE4rYrIuhw,55848616692737.43
Sistema de Trading RSI + Media M贸vil Ponderada para operar a corto plazo (intra-dia),Pablo Gil Trader,279000,242648,379,https://www.youtube.com/watch?v=ZmLposmKLvs,49836313899736.15
LA MEJOR MANERA DE HACER SWING TRADING EN ORO COMO UN PRO | SMART MONEY CONCEPTS | XAUUSD,TJ TRADING,6680,3629,9,https://www.youtube.com/watch?v=8gkngiSTLTs,17992743288.88889
COMO analizar en ORO XAUUSD en 3 simples pasos ESTRATEGIA GANADORA,YOSOYUNTRADERGANADOR,12900,6016,43,https://www.youtube.com/watch?v=Dy2aOGIDMBQ,23281920000.0
"Este TRADER tiene 80% de WINRATE utilizando esta FCIL ESTRATEGIA (+$1,000,000)",Alexflamas,119000,87304,249,https://www.youtube.com/watch?v=2A9FWLc2vtI,4965108208835.342
An谩lisis Trading Forex - Trading en ORO + 900 D贸lares,BURS ADVISORY,175000,4522,9,https://www.youtube.com/watch?v=Rq9_aeEGdUg,15387361111111.111
C贸mo INVERTIR en ORO 2024,BaiJavier,750000,55602,200,https://www.youtube.com/watch?v=pxMDa9Ht2Oc,156380625000000.0
"Trader, deja de perder en XAUUSD.",00XAU,4400,6257,46,https://www.youtube.com/watch?v=PWl30ZLvm8k,2633380869.565217
Gana dinero con estrateg铆a de Scalping en 1 minuto para el Oro,Ice Tradingt,4420,4049,1,https://www.youtube.com/watch?v=22TmRL0W5kI,79102883600.00002
Una ESTRATEGIA de TRADING para ser RENTABLE ( Cruce de Medias M贸viles ),Master Traders,122000,25460,218,https://www.youtube.com/watch?v=TiFCd8M9dbE,1738287339449.5413
梆 ESTE INDICADOR NUEVO ES ORO PURO 梆,ANDRS ARISTIZBAL,53300,10730,44,https://www.youtube.com/watch?v=_3cCuQoVzaI,692789765909.0908
La Mejor Estrategia Media M贸vil Exponencial (EMA). Estrategia simple de Trading,Trader Dorado,31400,42623,38,https://www.youtube.com/watch?v=iwAE7gyWB7E,1105909817894.7368
