Titulo,Nombre del Canal,Subcriptores,Vistas Totales,Numero de Comentarios,Direccion,Ratio
La MEJOR ESTRATEGIA para operar el ORO [XAUUSD],YOSOYUNTRADERGANADOR,13000,24502,78,https://www.youtube.com/watch?v=aSD5wVaa7NY,53087666666.66667
ESTRATEGIA CON EL ORO GANADORA INCLUSO EN LAS CRISIS 💪 | Backtesteada Durante 4 Años (XAU/USD),Trading Studio,13300,27476,45,https://www.youtube.com/watch?v=Kq80CzB1ZvU,108005103111.11111
✅Estrategia para operar con el ORO (XAUUSD) 2023 en Forex I Trading institucional,Santiago Trader,4350,23030,73,https://www.youtube.com/watch?v=OOgY2iLRI3Y,5969659931.506849
Estrategia Completa de XAUUSD al detalle,Enigmatic Trading,14600,22192,93,https://www.youtube.com/watch?v=BfYTQKwte6A,50865018494.62366
la MEJOR FORMA para OPERAR el XAUUSD (ORO) en FOREX | las ZONAS del XAUUSD,HOTMARKETGUY,6460,6352,17,https://www.youtube.com/watch?v=hN0oyuPEAaE,15592889600.0
Estrategia para tomar entradas en 5m en el XAUUSD,David Meza Trading,1170,683,12,https://www.youtube.com/watch?v=Z3Lla2nCfO0,77913225.0
ESTRATEGIA PARA XAUUSD 2022 - FACIL Y EFECTIVA,Lesther Day Trader,13200,830,4,https://www.youtube.com/watch?v=Sm-3Ncd_zVo,36154800000.0
Estrategia Institucional XAUUSD,Johan Rincon Fx,7880,10647,50,https://www.youtube.com/watch?v=HWbY35DHIlc,13222381535.999998
"ESTRATEGIA PARA XAUUSD, APRENDERAS A OPERAR EL ORO FACIL Y EFECTIVA.",DR.TRADER,2440,7130,55,https://www.youtube.com/watch?v=ba1Wphsy7ec,771803054.5454544
ESTRATEGIA de TRADING con ACCION DEL PRECIO para el ORO PROBADA 100 VECES👑 - ¡DEMASIADO FACIL!,Jack ́s Backtest - Estrategias de Trading,8340,3287,18,https://www.youtube.com/watch?v=saBf7CJFNfU,12701625400.0
COMO analizar en ORO XAUUSD en 3 simples pasos ESTRATEGIA GANADORA,YOSOYUNTRADERGANADOR,13000,6065,45,https://www.youtube.com/watch?v=Dy2aOGIDMBQ,22777444444.444443
La mejor ESTRATEGIA para hacer trading en ORO | Estrategias de Trading,Vida Emprendedora,134000,28213,28,https://www.youtube.com/watch?v=fuk6BmAW2s0,18092593857142.86
Como OPERAR EL ORO Y NO PERDER DINERO [Xauusd] | ALEXOSORIO,El Mentor,24700,20818,68,https://www.youtube.com/watch?v=FPpVuIjDBpc,186777259117.64703
"Deja de Buscar ESTRATEGIAS de TRADING , Mejor HAZ ESTO",Master Traders,124000,135460,268,https://www.youtube.com/watch?v=5W-H5xsE4mA,7771764776119.402
cómo GANAR ENTRADAS en XAUUSD | Estrategia para XAUUSD FIBONACCI SMART MONEY CONCEPTS,HOTMARKETGUY,6460,870,1,https://www.youtube.com/watch?v=VbzryViESC0,36306492000.0
"LA ESTRATEGIA QUE ME DIO $120,000 USD EN ENERO",El Sensei,776000,591453,1536,https://www.youtube.com/watch?v=jpzRaYM6cgM,231874219875000.0
"Trader, deja de perder en XAUUSD.",00XAU,4480,6360,47,https://www.youtube.com/watch?v=PWl30ZLvm8k,2715909446.808511
RR 1:65 CON 4 ENTRADAS PERFECTAS EN UNA MAÑANA EN EL ORO [XAUUSD] | ANALISIS DESDE CERO,It's Smart Money,111000,43237,453,https://www.youtube.com/watch?v=tJ2b-jadXaM,1175989132450.3313
la MEJOR ESTRATEGIA para OPERAR el ORO de FORMA CORRECTA | NO pierdas MÁS ENTRADAS!,HOTMARKETGUY,6460,3683,53,https://www.youtube.com/watch?v=-pBkm8aHESY,2899952505.6603765
Así se USA la MEJOR ESTRATEGIA de TRADING que EXISTE ( Fibonacci ),Master Traders,124000,147580,318,https://www.youtube.com/watch?v=CyBzabXTtQA,7135817861635.221
Como hacer SCALPING para GANAR en el ORO ( INCREIBLE ),Master Traders,124000,5348,55,https://www.youtube.com/watch?v=NKjMdbkjdyY,1495106327272.727
✅Como operar el ORO ? I Estrategia para el ORO I Curso para el oro Clase #1,Santiago Trader,4350,4422,64,https://www.youtube.com/watch?v=UFOlzBL44Dw,1307426484.3750002
Estrategia Explosiva para el ORO (XAUUSD),Coinducation,644,2247,4,https://www.youtube.com/watch?v=RQQ51jZz3qA,232977947.99999997
✅ Cómo tomar entradas en el ORO (XAUUSD) 2023 en Forex I Trading institucional,Santiago Trader,4350,7085,28,https://www.youtube.com/watch?v=kGD9ac9Khxc,4788068303.571428
LA MEJOR MANERA DE HACER SWING TRADING EN ORO COMO UN PRO | SMART MONEY CONCEPTS | XAUUSD,TJ TRADING,6680,3640,9,https://www.youtube.com/watch?v=8gkngiSTLTs,18047281777.777782
Estrategia  Para Pasar Cuentas de Fondeo / #xauusd,TRADING WEB HOUSE,8270,12544,697,https://www.youtube.com/watch?v=ivBM9PKlstE,1230875950.6456244
Las 2 Mejores Estrategias De Trading Para Empezar En 2024,Alex Ruiz,298000,183451,284,https://www.youtube.com/watch?v=PtQXzCit-K8,57363319028169.01
Aprende la Estrategia Secreta para Operar el XAUUSD / Entrada en vivo del Oro (Xauusd),Danni Casares,3360,3023,92,https://www.youtube.com/watch?v=7jayQNLB9yk,370961530.4347826
Estrategia de SCALPING Domina el TRADING con 2 Indicadores en 2024,JonyTrading 🔺,7940,42004,220,https://www.youtube.com/watch?v=LB5v2sCv8vg,12036742610.909092
Estrategia de Trading Secreta para operar ORO -XAUUSD,Gustavom.Trader,1890,465,7,https://www.youtube.com/watch?v=vx7P9FO3rd0,237289500.0
✅ ¿Cómo analizar el ORO? I XAUUSD I Trading institucional,Santiago Trader,4350,6206,13,https://www.youtube.com/watch?v=WmvnP89Q_gM,9033310384.615385
Gana dinero con estrategía de Scalping en 1 minuto para el Oro,Ice Tradingt,4420,4068,1,https://www.youtube.com/watch?v=22TmRL0W5kI,79474075200.0
✅¿Cual es la mejor forma de analizar el ORO en trading? -Analisis en vivo ORO Forex,Santiago Trader,4350,3346,22,https://www.youtube.com/watch?v=rByUaJRpBXc,2877940227.272728
Estrategia Institucional Scalping/Intraday - XAUUSD,Johan Rincon Fx,7880,8543,48,https://www.youtube.com/watch?v=ZjIQwti3zo8,11051509566.666666
Estrategia De Trading En Scalping Para Principiantes,Alex Ruiz,298000,201653,240,https://www.youtube.com/watch?v=omEXiOg5F4o,74614970883333.33
✅Estrategia para operar el ORO en forex  I Curso para el oro Clase #7,Santiago Trader,4350,1607,30,https://www.youtube.com/watch?v=IH94_DSQ_zY,1013615250.0000001
Estrategia para operar GOLD XAUUSD paso a paso 2024,kathcastello,1630,290,4,https://www.youtube.com/watch?v=I76vVlXto8Q,192625250.0
Todo Lo Que Necesitas Saber Sobre El ORO |  Análisis de Mercado por Pablo Gil,Pablo Gil Trader,280000,90729,338,https://www.youtube.com/watch?v=1aIF7z0nAd8,21044833136094.676
La Estrategia De Trading Definitiva Con Medias Móviles,Alex Ruiz,298000,81867,338,https://www.youtube.com/watch?v=JTraH1-aFRM,21509222094674.555
La MEJOR estrategia con FIBONACCI (MUY Fácil),Lalo Trading,15400,8419,139,https://www.youtube.com/watch?v=FmSAGWpumFM,14364388776.978416
ESTRATEGIA DE TRADING PARA OPERAR CON ORO 💰,Libertex Partner de Libertad Academy,11900,13079,15,https://www.youtube.com/watch?v=S6xS0JKwA0Y,123474479333.33333
Estrategia para operar el ORO 2024 I Trading I Santiago Trader,Santiago Trader,4350,3017,6,https://www.youtube.com/watch?v=RqVJHiL8kLg,9514863750.0
Estrategia Day Trading 2024 ICT x SMC en ORO (XAUUSD),Gustavom.Trader,1890,741,4,https://www.youtube.com/watch?v=jGa496bAnn8,661731524.9999999
✅Como operar el ORO ? I Estrategia para el ORO I Curso para el oro Clase #8,Santiago Trader,4350,2459,18,https://www.youtube.com/watch?v=61uxSLWr3oE,2585023750.0
ESTRATEGIA PARA TARDEAR ORO #xauusd LA MEJOR ESTRATEGIA DE TRADING,Trading Degend FX,1230,169,5,https://www.youtube.com/watch?v=e2dvWyakUMo,51136019.99999999
EA GRATIS!!! Comercia  XAUUSD como un PROFESIONAL [NoGrid-NoMartingale] MT4,JACKE MATE-NoHedge-NoGrid-Nomartingale,975,8067,39,https://www.youtube.com/watch?v=yMM2uCvEug8,196633125.0
¿SERÀ ESTE EL MEJOR INDICADOR DE TRADINGVIEW? 🤑 | 206% De Rentabilidad En Un Mes,Trading Studio,13300,86116,284,https://www.youtube.com/watch?v=WzvViX_ZMMA,53637532535.211266
Mejor estrategia para operar el Oro XAUUSD - En Vivo,Juan Cediel,194,1820,0,https://www.youtube.com/watch?v=F6cQP8MBaXc,inf
Estrategia de trading forex en tokio,BURS ADVISORY,175000,35043,459,https://www.youtube.com/watch?v=Iot3_Ct6nLw,2338108660130.719
Los 3 PASOS para ANALIZAR tus GRAFICOS y GANAR en el TRADING,Master Traders,124000,112119,246,https://www.youtube.com/watch?v=GntisDlNtV0,7007893268292.683
