Titulo,Nombre del Canal,Subcriptores,Vistas Totales,Numero de Comentarios,Direccion,Ratio
XAUUSD Scalping Strategy,The Moving Average,958000,1294914,558,https://www.youtube.com/watch?v=oDOCBTYgCQM,2129794717376344.0
BEST Trend Following Strategies for GOLD. XAUUSD DAY TRADING in 2024 (Get MAXIMUM Pips),VasilyTrader,26100,15055,20,https://www.youtube.com/watch?v=Uvq5nhuzX9o,512780827499.99994
Make $3K Every DAY Trading GOLD (Easy Strategy),Trade with Pat,201000,199386,267,https://www.youtube.com/watch?v=nE9Zrf7HowY,30170014179775.273
BEST Gold Trading Strategy You&#39;ll EVER SEE!,Trade with Pat,201000,180553,232,https://www.youtube.com/watch?v=rtl2EaJuWko,31441904107758.62
This GOLD Trading Strategy makes me $1000 a day,The Trading Geek,990000,753968,767,https://www.youtube.com/watch?v=AY7fWmE1CBk,963447244850065.4
"The Only GOLD Trading Strategy You Need to Turn 10$ to 1,800$ Daily",VasilyTrader,26100,98375,175,https://www.youtube.com/watch?v=dCRSkQpbENU,382937335714.2857
EASIEST XAUUSD Trading Strategy ANYONE Can Do!,TheForexHeist,27700,16803,186,https://www.youtube.com/watch?v=BdQsxuIszbo,69315988548.38712
I Discovered the Secret to XAUUSD Trading (Strategy) Pt. 1,Samuel Tochi,28800,64372,191,https://www.youtube.com/watch?v=pVT0d49f_gU,279542993089.00525
Proven 5-Minute Forex Scalping Strategy for XAUUSD/GOLD. 🦁📈,Forex Trading Lions,14000,117349,35,https://www.youtube.com/watch?v=fSp-jMvNOhE,657154400000.0
GOLD TRADING STRATEGY TODAY 8-9 OCT | XAUUSD ANALYSIS TODAY 8-9 OCT | XAUUSD FORECAST TODAY 8-9 OCT,The Trader Next Door,63600,2213,32,https://www.youtube.com/watch?v=_4WqJdslnos,279734265000.00006
How to Trade XAU/USD: Best Gold Trading Strategy?,TraderNick,455000,420067,365,https://www.youtube.com/watch?v=yuFfAM2abhQ,238258549794520.56
My favourite supply and demand playbook on XAUUSD | Forex Day Trading,Sully's Advice,69100,22511,39,https://www.youtube.com/watch?v=KhF3xw84A1Y,2756044818205.128
GOLDEN STRATEGY FOR GOLD ( XAUUSD ),Young Trader Viraj,155000,28585,203,https://www.youtube.com/watch?v=z7jmHFIRIgI,3383027709359.607
XAUUSD Scalping Strategy: 5 Minutes Timeframe !,Transparent Fx Academy,149000,51597,37,https://www.youtube.com/watch?v=njjug8HxiUM,30959594513513.516
Best ICT Gold Trading Strategy That Works Every Time! (High Winrate),Faiz SMC,128000,341499,1072,https://www.youtube.com/watch?v=4ZY5OTWt3vU,5219328000000.0
Gold / XAUUSD scalping trading strategy for high profits,The Trading Guide,35800,22958,108,https://www.youtube.com/watch?v=Zc8G2VFAYJc,272443436296.29636
The BEST Forex Trading Strategy for Gold *LIVE TRADING XAU/USD*,Jooviers Gems,535000,72923,178,https://www.youtube.com/watch?v=vJvlj3NkmtM,117260593679775.28
The Ultimate Guide to Trading Gold (XAU/USD) | FREE COURSE,TraderNick,455000,111238,227,https://www.youtube.com/watch?v=jvrucuw38oo,101449546035242.3
GOLD TRADING STRATEGY MONDAY 7 OCT | XAUUSD ANALYSIS MONDAY 7 OCT | XAUUSD FORECAST MONDAY 7 OCT,The Trader Next Door,63600,4898,68,https://www.youtube.com/watch?v=y5HLUCckBW0,291356089411.7647
95% Profitable Forex Trading Strategy for XAUUSD,Saint Patrick Fx,28700,6657,4,https://www.youtube.com/watch?v=5i0aoiIGPHE,1370826082500.0
Scalping XAUUSD without failing a single account? FTMO Trader shares his strategy! | FTMO,FTMO,397000,153057,224,https://www.youtube.com/watch?v=Yc-fwhNz8do,107692681754464.28
Top 3 Gold Trading Tips for 2024,BKTraders - Kathy Lien & Boris Schlossberg,62500,122857,184,https://www.youtube.com/watch?v=KkChMmTz9kU,2608207370923.9136
Gold Live Signals - XAUUSD TIME FRAME 5 Minute M5  |  Best Forex Strategy Almost No Risk,ForexLia,253000,10901740,0,https://www.youtube.com/watch?v=Cf9klXhb0G8,inf
How I Made $2500 LIVE Trading XAUUSD | Forex Supply &amp; Demand Strategy,Sully's Advice,69100,16047,61,https://www.youtube.com/watch?v=EykLC5p06PE,1256088132295.082
How I Scalp Gold in 2022,The Trading Geek,990000,340363,231,https://www.youtube.com/watch?v=lMMdvriN0d8,1444111585714285.8
Live XAUUSD GOLD- My Trading Strategy-08/10/24,FOREX & GOLD,144000,11613,0,https://www.youtube.com/watch?v=Y0H-DUJ5oQQ,inf
XAUUSD scalping Strategy (Easy For Beginners),KOJO FOREX,257000,89487,357,https://www.youtube.com/watch?v=QkxFFdUTaTY,16556097655462.188
The Only GOLD (XAUUSD) Trading Strategy You Need in 2023,Samuel Tochi,28800,45040,140,https://www.youtube.com/watch?v=XsZ5ond_7n4,266842697142.85715
XAU/USD (GOLD) 5 minute Scalping Trading Strategy | support and resistance zones | Price Action 2022,Forex Trading Worker,109000,23777,34,https://www.youtube.com/watch?v=5wWvw8TK7UM,8308662852941.177
Live XAUUSD GOLD- My Trading Strategy-07/10/24,FOREX & GOLD,144000,31637,0,https://www.youtube.com/watch?v=XEA-QaxgXDI,inf
How to Trade XAUUSD: Best Gold Trading Strategy?,WillssFX,81800,52902,57,https://www.youtube.com/watch?v=q6NayXQgZFs,6210175061052.631
STEAL this ICT Gold Trading Strategy &amp; Pass Your Challenges (XAUUSD),The Trading Tiger,2210,18651,53,https://www.youtube.com/watch?v=YIaga0UvsiQ,1718742435.8490567
Four Price Action Secrets (The Ultimate Guide To Price Action),TradingLab,1260000,1087631,896,https://www.youtube.com/watch?v=0L6Rcgp6j7Y,1927146178124999.8
I Found A Trading Strategy With a 225% Profit Rate #shorts,TradingLab,1260000,1419320,584,https://www.youtube.com/watch?v=O2-oSMyzTzs,3858411698630137.5
"Scalping was Hard, until I Found this SECRET",The Trading Geek,990000,1183194,1293,https://www.youtube.com/watch?v=fEQadvrrXl4,896866542459396.8
Best Gold Trading Strategy With 83% Winrate! (Insane Accuracy),Faiz SMC,128000,43592,265,https://www.youtube.com/watch?v=rXUDahzLjZM,2695137086792.4526
The Only XAUUSD Trading Strategy You Need!!…Mobile Strategy,Malvin,8380,16895,18,https://www.youtube.com/watch?v=PkjOj8JU-oc,65913402111.11111
How to Trade XAUUSD: Best Gold Trading Strategy in 2023,Petko Aleksandrov,62900,21232,21,https://www.youtube.com/watch?v=i2ZXJNwwaz0,4000118910476.1904
🎯 99% Gold Secret Strategy,Saint Patrick Fx,28700,29961,51,https://www.youtube.com/watch?v=5-fGIKl8WdM,483893648823.5294
Very PROFITABLE Trading Strategy with Only 1 Indicator! #shorts,Hyper Trade,60500,1568553,306,https://www.youtube.com/watch?v=10AQTV-xCzI,18762405615196.08
The HIGHEST Win Rate GOLD Scalping Strategy (83% Winrate),Trade with Pat,201000,73342,165,https://www.youtube.com/watch?v=kqN5qUFUY9E,17958122072727.27
200 PIPS a Day XAUUSD 5 Minute Trading Strategy,Ajwad Trades,15900,23750,32,https://www.youtube.com/watch?v=yr9H-fVEJ0w,187632421875.0
BEST 1 MINUTE SCALPING STRATEGY,BORSA 321,73300,695400,371,https://www.youtube.com/watch?v=3hJyExgLnwY,10070910258760.107
GOLD TRADING STRATEGY TODAY 7-8 OCT | XAUUSD ANALYSIS TODAY 7-8 OCT | XAUUSD FORECAST TODAY 7-8 OCT,The Trader Next Door,63600,4139,41,https://www.youtube.com/watch?v=cweWDfVD4y4,408343644878.04877
SNIPER FOREX SCALPING STRATEGY!!! | WORKS ON US30 &amp; XAUUSD  (FIBONACCI STRATEGY 2020),Doyle Exchange,142000,278584,1303,https://www.youtube.com/watch?v=_opTZIbmuTQ,4311103435149.655
98% Forex Gold XAU USD Scalping Strategy,Saint Patrick Fx,28700,57036,45,https://www.youtube.com/watch?v=o1YLQaiHxl0,1043999618666.6667
Best Gold Trading Strategy? Backtesting a XAU/USD Trend Trading Strategy!,TraderNick,455000,14667,102,https://www.youtube.com/watch?v=dAR52QcK9mg,29768977205882.35
"Live Trading XAUUSD: $24,000 IN 1 HOUR! (EASY Forex Strategy)",TheForexHeist,27700,13651,98,https://www.youtube.com/watch?v=TsFDZr3A9_0,106880365204.08162
New Trader VS Experience Trader | Xauusd FVG Trading Strategy | #trading #forex #xauusd #shorts,The Positive Trader,67900,348864,110,https://www.youtube.com/watch?v=AbQ7JP6sR4s,14621873402181.814
"How to Trade XAU/USD: Best Gold Trading Strategy? (11 MAR,2022) #short #xauusd #gold",DayTrading,1410,40893,8,https://www.youtube.com/watch?v=KWHHfz-Nj9o,10162421662.499998
