Titulo,Nombre del Canal,Subcriptores,Vistas Totales,Numero de Comentarios,Direccion,Ratio
Best ICT Gold Trading Strategy That Works Every Time! (High Winrate),Faiz SMC,128000,345281,1112,https://www.youtube.com/watch?v=4ZY5OTWt3vU,5087305669064.748
BEST Gold Trading Strategy You&#39;ll EVER SEE!,Trade with Pat,202000,182184,238,https://www.youtube.com/watch?v=rtl2EaJuWko,31234604773109.246
BEST Trend Following Strategies for GOLD. XAUUSD DAY TRADING in 2024 (Get MAXIMUM Pips),VasilyTrader,26200,15538,22,https://www.youtube.com/watch?v=Uvq5nhuzX9o,484813850909.0909
3 Key Tips for Trading Gold!,TraderNick,456000,96064,96,https://www.youtube.com/watch?v=oc2zqnvsqi0,208074624000000.0
XAUUSD Scalping Strategy,The Moving Average,959000,1298441,559,https://www.youtube.com/watch?v=oDOCBTYgCQM,2136228116853309.5
This GOLD Trading Strategy makes me $1000 a day,The Trading Geek,993000,759747,767,https://www.youtube.com/watch?v=AY7fWmE1CBk,976724601829204.6
Top 3 Gold Trading Tips for 2024,BKTraders - Kathy Lien & Boris Schlossberg,62700,123535,184,https://www.youtube.com/watch?v=KkChMmTz9kU,2639412555163.0435
"BEST Scalping Trading Strategy For Beginners (How To Scalp Forex, Stocks, and Crypto)",TradingLab,1260000,629965,1137,https://www.youtube.com/watch?v=XBcMiYK7qYY,879623952506596.5
Proven 5-Minute Forex Scalping Strategy for XAUUSD/GOLD. 🦁📈,Forex Trading Lions,14000,118791,36,https://www.youtube.com/watch?v=fSp-jMvNOhE,646751000000.0
"The Only GOLD Trading Strategy You Need to Turn 10$ to 1,800$ Daily",VasilyTrader,26200,99447,176,https://www.youtube.com/watch?v=dCRSkQpbENU,387865901590.9091
Make $3K Every DAY Trading GOLD (Easy Strategy),Trade with Pat,202000,200254,269,https://www.youtube.com/watch?v=nE9Zrf7HowY,30376075152416.36
The best time to trade gold (XAUUSD) | Part 1 | Gold trading strategy,TIOmarkets,5680,60236,54,https://www.youtube.com/watch?v=F3fgiERWYQQ,35988109748.14815
The ONLY ICT Gold Trading Strategy That You Need To Know with a HIGH WINRATE!,SimulationFX,26900,12408,33,https://www.youtube.com/watch?v=uAL84CwKh3g,272077359999.99997
MOST BASIC ICT Liquidity Strategy for GOLD (Pass Prop Firms),Solo E TV,101000,23677,82,https://www.youtube.com/watch?v=RAT0_ZmiMX4,2945476548780.488
The Heikin Ashi Trading Strategy (Simple &amp; Effective),TradingLab,1260000,531073,595,https://www.youtube.com/watch?v=2G78zkuQSc0,1417027722352941.2
BEST MACD Trading Strategy [86% Win Rate],TradingLab,1260000,2647878,3646,https://www.youtube.com/watch?v=rf_EQvubKlk,1152981654635216.5
THE BEST STRATEGY ON GOLD IN 2024!!!!,PrecisionFX_EAGLE,14200,57803,184,https://www.youtube.com/watch?v=VMFMMBDl07w,63344548478.260864
The BEST Forex Trading Strategy for Gold *LIVE TRADING XAU/USD*,Jooviers Gems,536000,73118,178,https://www.youtube.com/watch?v=vJvlj3NkmtM,118014095101123.6
I Found A Trading Strategy With a 225% Profit Rate #shorts,TradingLab,1260000,1423440,572,https://www.youtube.com/watch?v=O2-oSMyzTzs,3950792559440560.0
Best Gold Trading Strategy? Backtesting a XAU/USD Trend Trading Strategy!,TraderNick,456000,14730,102,https://www.youtube.com/watch?v=dAR52QcK9mg,30028404705882.35
The Only 5minutes GOLD Trading Strategy You Will Ever Need,ForexWizard,45300,36537,39,https://www.youtube.com/watch?v=xGrHuoWBrjw,1922492623846.1538
5 Essential Gold Trading Tips for 2024 - Gold Trading Strategy,BKTraders - Kathy Lien & Boris Schlossberg,62700,45369,66,https://www.youtube.com/watch?v=Vgqf2afNueM,2702404485000.0
BEST Trend Lines Strategy for Daytrading Forex &amp; Stocks (Simple Technique),Data Trader,478000,449453,551,https://www.youtube.com/watch?v=vzC-D1Uc0J8,186375352544464.6
Revealing My Ultimate Gold Trading Strategy,Kommon Forex,13100,40891,86,https://www.youtube.com/watch?v=8Fr7YVKXfcg,81596564069.76744
Commodities Outlook - The Secrets to Trading Gold - Bloomberg,Bloomberg Originals,4220000,61174,37,https://www.youtube.com/watch?v=TcVgq0doQS4,2.9443542205405404e+16
How to Trade XAU/USD: Best Gold Trading Strategy?,TraderNick,456000,420579,365,https://www.youtube.com/watch?v=yuFfAM2abhQ,239598671079452.03
My Forex Gold Trend Trading Breakout Strategy!,Tradesharpe,68700,15156,49,https://www.youtube.com/watch?v=KIr1y_A56B4,1459829013061.2244
The HIGHEST Win Rate GOLD Scalping Strategy (83% Winrate),Trade with Pat,202000,74131,165,https://www.youtube.com/watch?v=kqN5qUFUY9E,18332371660606.06
Four Price Action Secrets (The Ultimate Guide To Price Action),TradingLab,1260000,1094553,889,https://www.youtube.com/watch?v=0L6Rcgp6j7Y,1954682050393700.8
The Only GOLD 15min Day Trading Strategy You Will Ever Need,ForexWizard,45300,81235,132,https://www.youtube.com/watch?v=Yj6vDKTVvM4,1262890387500.0
"$20,379 1 Minute GOLD Scalping Strategy (BEST Volume Indicator!)",Trade with Pat,202000,77340,284,https://www.youtube.com/watch?v=r6e0SuXWQjg,11111906197183.1
Day Trading THE OPEN ON GOLD - 50 Pips A Day,Stacey Burke Trading,81900,82000,173,https://www.youtube.com/watch?v=b93KDgynGuU,3179329595375.7227
How I Scalp Gold in 2022,The Trading Geek,993000,340994,231,https://www.youtube.com/watch?v=lMMdvriN0d8,1455570531194805.2
ULTIMATE GOLD Day Trading Strategy (WIN 85%),Trade with Pat,202000,98019,337,https://www.youtube.com/watch?v=v3f5gHblXMc,11868152154302.67
How to Trade XAUUSD: Best Gold Trading Strategy?,WillssFX,81800,52941,57,https://www.youtube.com/watch?v=q6NayXQgZFs,6214753277894.736
Best Gold Trading Strategy With 83% Winrate! (Insane Accuracy),Faiz SMC,128000,45916,276,https://www.youtube.com/watch?v=rXUDahzLjZM,2725680231884.058
Best Candle Formation for 5 Minute Scalping,The Moving Average,959000,382180,877,https://www.youtube.com/watch?v=RyTlRkMujuk,400779571927024.0
How I trade Gold 2024,WealthFRX,33300,114055,87,https://www.youtube.com/watch?v=OXWfi2bitpI,1453729298275.862
Best ICT Gold Trading Strategy That Works! (Part 2),Faiz SMC,128000,92307,501,https://www.youtube.com/watch?v=kb9D3KR4t08,3018678419161.6763
This Scalping Strategy will Grow SMALL Forex Accounts *PRICE ACTION*,The Trading Geek,993000,1070425,1378,https://www.youtube.com/watch?v=8LQsR7B2vQ0,765958999147315.0
15 Best Price Action Strategies After 15 Years of Trading (The Holy Grail),Wysetrade,1330000,1503743,1353,https://www.youtube.com/watch?v=FBdN2L8SSyY,1965980038950480.5
How To Grow A Small Stock Account,TradingLab,1260000,831729,1202,https://www.youtube.com/watch?v=5nPRbWwxPUQ,1098546556073211.2
I Tested This Trading Strategy &amp; It Made 310%,TradingLab,1260000,1363584,746,https://www.youtube.com/watch?v=vQeyR1LMB7c,2901911472386059.0
The Only Gold Hedging Strategy you’ll ever need! 😂😂 || Anish Singh Thakur || Booming Bulls #shorts,Booming Bulls,2310000,3077593,935,https://www.youtube.com/watch?v=QINEFblpd-Y,1.7564004285882352e+16
I Found The Best Day Trading Strategy For Gold ( Insanely Profitable ! ),TradeIQ ,218000,68204,173,https://www.youtube.com/watch?v=gMMrlTikutc,18735993618497.11
Very PROFITABLE Trading Strategy with Only 1 Indicator! #shorts,Hyper Trade,60600,1576666,306,https://www.youtube.com/watch?v=10AQTV-xCzI,18921846901176.47
How to Trade XAUUSD: Best Gold Trading Strategy in 2023,Petko Aleksandrov,63000,21255,21,https://www.youtube.com/watch?v=i2ZXJNwwaz0,4017195000000.0
I Found An AMAZING Trend Following Strategy #shorts,TradingLab,1260000,1050295,682,https://www.youtube.com/watch?v=YV-gwsg2Ekc,2444938917888563.0
1 Minute Scalping Strategy - SO SIMPLE that anybody can do it!,The Moving Average,959000,329455,124,https://www.youtube.com/watch?v=Du81XPkPOHQ,2443495998830645.0
THE BEST FOREX TRADING STRATEGY | KEEP IT SIMPLE,Trade Forex with Paul,28500,421869,965,https://www.youtube.com/watch?v=LwGp9YH7H-g,355091290414.5077
