Titulo,Nombre del Canal,Subcriptores,Vistas Totales,Numero de Comentarios,Direccion,Ratio
XAUUSD Scalping Strategy,The Moving Average,959000,1298441,559,https://www.youtube.com/watch?v=oDOCBTYgCQM,2136228116853309.5
BEST Gold Trading Strategy You&#39;ll EVER SEE!,Trade with Pat,202000,182184,238,https://www.youtube.com/watch?v=rtl2EaJuWko,31234604773109.246
BEST Trend Following Strategies for GOLD. XAUUSD DAY TRADING in 2024 (Get MAXIMUM Pips),VasilyTrader,26200,15538,22,https://www.youtube.com/watch?v=Uvq5nhuzX9o,484813850909.0909
This GOLD Trading Strategy makes me $1000 a day,The Trading Geek,993000,759747,767,https://www.youtube.com/watch?v=AY7fWmE1CBk,976724601829204.6
Make $3K Every DAY Trading GOLD (Easy Strategy),Trade with Pat,202000,200254,269,https://www.youtube.com/watch?v=nE9Zrf7HowY,30376075152416.36
3 Key Tips for Trading Gold!,TraderNick,456000,96064,96,https://www.youtube.com/watch?v=oc2zqnvsqi0,208074624000000.0
"The Only GOLD Trading Strategy You Need to Turn 10$ to 1,800$ Daily",VasilyTrader,26200,99447,176,https://www.youtube.com/watch?v=dCRSkQpbENU,387865901590.9091
Best Gold Trading Strategy With 83% Winrate! (Insane Accuracy),Faiz SMC,128000,45916,276,https://www.youtube.com/watch?v=rXUDahzLjZM,2725680231884.058
Best ICT Gold Trading Strategy That Works Every Time! (High Winrate),Faiz SMC,128000,345281,1112,https://www.youtube.com/watch?v=4ZY5OTWt3vU,5087305669064.748
How to Trade XAU/USD: Best Gold Trading Strategy?,TraderNick,456000,420579,365,https://www.youtube.com/watch?v=yuFfAM2abhQ,239598671079452.03
GOLDEN STRATEGY FOR GOLD ( XAUUSD ),Young Trader Viraj,155000,29198,203,https://www.youtube.com/watch?v=z7jmHFIRIgI,3455576108374.3843
EASIEST XAUUSD Trading Strategy ANYONE Can Do!,TheForexHeist,27700,16860,186,https://www.youtube.com/watch?v=BdQsxuIszbo,69551125806.45161
Gold Live Signals - XAUUSD TIME FRAME 5 Minute M5  |  Best Forex Strategy Almost No Risk,ForexLia,254000,10956715,0,https://www.youtube.com/watch?v=Cf9klXhb0G8,inf
Proven 5-Minute Forex Scalping Strategy for XAUUSD/GOLD. 🦁📈,Forex Trading Lions,14000,118791,36,https://www.youtube.com/watch?v=fSp-jMvNOhE,646751000000.0
Top 3 Gold Trading Tips for 2024,BKTraders - Kathy Lien & Boris Schlossberg,62700,123535,184,https://www.youtube.com/watch?v=KkChMmTz9kU,2639412555163.0435
Revealing My Ultimate Gold Trading Strategy,Kommon Forex,13100,40891,86,https://www.youtube.com/watch?v=8Fr7YVKXfcg,81596564069.76744
The BEST Forex Trading Strategy for Gold *LIVE TRADING XAU/USD*,Jooviers Gems,536000,73118,178,https://www.youtube.com/watch?v=vJvlj3NkmtM,118014095101123.6
I Discovered the Secret to XAUUSD Trading (Strategy) Pt. 1,Samuel Tochi,28900,64637,191,https://www.youtube.com/watch?v=pVT0d49f_gU,282646433350.7853
The best time to trade gold (XAUUSD) | Part 1 | Gold trading strategy,TIOmarkets,5680,60236,54,https://www.youtube.com/watch?v=F3fgiERWYQQ,35988109748.14815
The Only GOLD (XAUUSD) Trading Strategy You Need in 2023,Samuel Tochi,28900,45176,140,https://www.youtube.com/watch?v=XsZ5ond_7n4,269510335428.57144
The HIGHEST Win Rate GOLD Scalping Strategy (83% Winrate),Trade with Pat,202000,74131,165,https://www.youtube.com/watch?v=kqN5qUFUY9E,18332371660606.06
How I Scalp Gold in 2022,The Trading Geek,993000,340994,231,https://www.youtube.com/watch?v=lMMdvriN0d8,1455570531194805.2
I Tested This Trading Strategy &amp; It Made 310%,TradingLab,1260000,1363584,746,https://www.youtube.com/watch?v=vQeyR1LMB7c,2901911472386059.0
How to Trade XAUUSD: Best Gold Trading Strategy in 2023,Petko Aleksandrov,63000,21255,21,https://www.youtube.com/watch?v=i2ZXJNwwaz0,4017195000000.0
I Found An AMAZING Trend Following Strategy #shorts,TradingLab,1260000,1050295,682,https://www.youtube.com/watch?v=YV-gwsg2Ekc,2444938917888563.0
How to Trade XAUUSD: Best Gold Trading Strategy?,WillssFX,81800,52941,57,https://www.youtube.com/watch?v=q6NayXQgZFs,6214753277894.736
How To Predict Reversals,TradingLab,1260000,4629615,1815,https://www.youtube.com/watch?v=2A2CqCmDbl0,4049573980165289.0
Gold 5 min scalping Strategy || tradelikemalika #forextrading #trading,Trade Like Malika,42000,24325,53,https://www.youtube.com/watch?v=SH6ILKnM5_A,809609433962.264
Very PROFITABLE Trading Strategy with Only 1 Indicator! #shorts,Hyper Trade,60600,1576666,306,https://www.youtube.com/watch?v=10AQTV-xCzI,18921846901176.47
3 SECRETS OF GOLD (XAUUSD),Young Trader Viraj,155000,97085,424,https://www.youtube.com/watch?v=SLMs3Rt6Q3A,5501101709905.66
I Found A Trading Strategy With a 225% Profit Rate #shorts,TradingLab,1260000,1423440,572,https://www.youtube.com/watch?v=O2-oSMyzTzs,3950792559440560.0
BEST TradingView Indicator for Day Trading GOLD! (Easy STRATEGY),Trade with Pat,202000,122153,229,https://www.youtube.com/watch?v=5xR-Jhy6E2o,21765637606986.9
🎯 99% Gold Secret Strategy,Saint Patrick Fx,28700,30042,51,https://www.youtube.com/watch?v=5-fGIKl8WdM,485201862352.94104
95% Profitable Forex Trading Strategy for XAUUSD,Saint Patrick Fx,28700,6714,4,https://www.youtube.com/watch?v=5i0aoiIGPHE,1382563665000.0
"Live Trading XAUUSD: $24,000 IN 1 HOUR! (EASY Forex Strategy)",TheForexHeist,27700,13705,98,https://www.youtube.com/watch?v=TsFDZr3A9_0,107303157653.06125
XAUUSD Scalping Strategy: 5 Minutes Timeframe !,Transparent Fx Academy,149000,51934,37,https://www.youtube.com/watch?v=njjug8HxiUM,31161803621621.63
Live XAUUSD GOLD- My Trading Strategy-11/10,FOREX & GOLD,145000,9341,0,https://www.youtube.com/watch?v=eCkiIoJwCOg,inf
THE BEST SCALPING INDICATOR ON TRADINGVIEW | STRATEGY | SCALPING | 1MINUTE | #forex,Valor Algo,12200,663936,431,https://www.youtube.com/watch?v=0TnTKymJ_VE,229281285939.67517
"BEST Scalping Trading Strategy For Beginners (How To Scalp Forex, Stocks, and Crypto)",TradingLab,1260000,629958,1137,https://www.youtube.com/watch?v=XBcMiYK7qYY,879614178364116.0
• Forex Gold Trading Strategy Live | Forex Gold Live Trading Tutorial 2022,Precious Pips,4790,339354,285,https://www.youtube.com/watch?v=kY4jOziglF0,27319902145.263153
BEST MACD Trading Strategy [86% Win Rate],TradingLab,1260000,2647858,3646,https://www.youtube.com/watch?v=rf_EQvubKlk,1152972945913329.8
Don’t Trade Gold (XAUUSD) As A Beginner,Jeffrey Benson Forex,334000,50312,502,https://www.youtube.com/watch?v=GpOviqw7_AE,11180488988047.809
MY BEST MOBILE STRATEGY FOR LONG TRADE#forextrading #short,Ahmad 12fx,4410,126079,57,https://www.youtube.com/watch?v=rM3Wst4IEL8,43017491226.31579
BEST 1 MINUTE SCALPING STRATEGY,BORSA 321,73500,698911,374,https://www.youtube.com/watch?v=3hJyExgLnwY,10095433020721.926
"How I Made $1,400,000 in 2022 with Trading",Umar Ashraf,776000,1262151,736,https://www.youtube.com/watch?v=dwEdZ0kJazQ,1032659022521739.1
My Forex Gold Trend Trading Breakout Strategy!,Tradesharpe,68700,15156,49,https://www.youtube.com/watch?v=KIr1y_A56B4,1459829013061.2244
MOST BASIC ICT Liquidity Strategy for GOLD (Pass Prop Firms),Solo E TV,101000,23677,82,https://www.youtube.com/watch?v=RAT0_ZmiMX4,2945476548780.488
NEW TRADER PSYCHOLOGY  #tradingview | Stock | Market | crypto | Trading | #shorts,BEGINNER TRADER HELPER,377000,3440942,1086,https://www.youtube.com/watch?v=0F2204ehuP0,450329323681399.6
How I trade Gold 2024,WealthFRX,33300,114055,87,https://www.youtube.com/watch?v=OXWfi2bitpI,1453729298275.862
Best Gold Trading Strategy? Backtesting a XAU/USD Trend Trading Strategy!,TraderNick,456000,14730,102,https://www.youtube.com/watch?v=dAR52QcK9mg,30028404705882.35
