Titulo,Nombre del Canal,Subcriptores,Vistas Totales,Numero de Comentarios,Direccion,Ratio
"The Only GOLD Trading Strategy You Need to Turn 10$ to 1,800$ Daily",VasilyTrader,26100,98375,175,https://www.youtube.com/watch?v=dCRSkQpbENU,382937335714.2857
The HIGHEST Win Rate GOLD Scalping Strategy (83% Winrate),Trade with Pat,201000,73342,165,https://www.youtube.com/watch?v=kqN5qUFUY9E,17958122072727.27
Make $3K Every DAY Trading GOLD (Easy Strategy),Trade with Pat,201000,199386,267,https://www.youtube.com/watch?v=nE9Zrf7HowY,30170014179775.273
3 Key Tips for Trading Gold!,TraderNick,455000,93999,95,https://www.youtube.com/watch?v=oc2zqnvsqi0,204843610263157.84
90% winning strategy for Gold,Forex Content,0,35,0,https://www.youtube.com/watch?v=ajLiz0xqIMQ,
BEST MACD Trading Strategy [86% Win Rate],TradingLab,1260000,2636193,3612,https://www.youtube.com/watch?v=rf_EQvubKlk,1158698783720930.2
This GOLD Trading Strategy makes me $1000 a day,The Trading Geek,990000,753968,767,https://www.youtube.com/watch?v=AY7fWmE1CBk,963447244850065.4
Top 3 Gold Trading Tips for 2024,BKTraders - Kathy Lien & Boris Schlossberg,62500,122857,184,https://www.youtube.com/watch?v=KkChMmTz9kU,2608207370923.9136
BEST Gold Trading Strategy You&#39;ll EVER SEE!,Trade with Pat,201000,180553,232,https://www.youtube.com/watch?v=rtl2EaJuWko,31441904107758.62
Best ICT Gold Trading Strategy That Works Every Time! (High Winrate),Faiz SMC,128000,341505,1072,https://www.youtube.com/watch?v=4ZY5OTWt3vU,5219419701492.538
ULTIMATE GOLD Day Trading Strategy (WIN 85%),Trade with Pat,201000,97813,337,https://www.youtube.com/watch?v=v3f5gHblXMc,11726240394658.754
I Found A Trading Strategy With a 225% Profit Rate #shorts,TradingLab,1260000,1419320,584,https://www.youtube.com/watch?v=O2-oSMyzTzs,3858411698630137.5
XAUUSD Scalping Strategy,The Moving Average,958000,1294914,558,https://www.youtube.com/watch?v=oDOCBTYgCQM,2129794717376344.0
Very PROFITABLE Trading Strategy with Only 1 Indicator! #shorts,Hyper Trade,60500,1568553,306,https://www.youtube.com/watch?v=10AQTV-xCzI,18762405615196.08
I Found An AMAZING Trend Following Strategy #shorts,TradingLab,1260000,1037639,675,https://www.youtube.com/watch?v=YV-gwsg2Ekc,2440526927999999.5
How I Scalp Gold in 2022,The Trading Geek,990000,340363,231,https://www.youtube.com/watch?v=lMMdvriN0d8,1444111585714285.8
Proven 5-Minute Forex Scalping Strategy for XAUUSD/GOLD. 🦁📈,Forex Trading Lions,14000,117349,35,https://www.youtube.com/watch?v=fSp-jMvNOhE,657154400000.0
Commodities Outlook - The Secrets to Trading Gold - Bloomberg,Bloomberg Originals,4210000,60855,37,https://www.youtube.com/watch?v=TcVgq0doQS4,2.9151354202702704e+16
BEST Trend Following Strategies for GOLD. XAUUSD DAY TRADING in 2024 (Get MAXIMUM Pips),VasilyTrader,26100,15055,20,https://www.youtube.com/watch?v=Uvq5nhuzX9o,512780827499.99994
Strategic Minds: Gold-Medal-Winning Strategy,Rich Horwath,6610,1756,0,https://www.youtube.com/watch?v=GHl6U3kdUWo,inf
HIGH WIN RATE STRATEGY FOR GOLD SCALPS #trading #forex #daytrading #money #stocks,CallistoFX,96200,4167,2,https://www.youtube.com/watch?v=8-zB4WsnGiQ,19281625740000.004
91% Win Rate Highly Profitable Secret Strategy | Laguerre RSI + Secret Indicator,Trading Nerds,20800,158394,191,https://www.youtube.com/watch?v=PVE_uYxexxQ,358783142198.9529
1 Minute Scalping Strategy - SO SIMPLE that anybody can do it!,The Moving Average,958000,328044,124,https://www.youtube.com/watch?v=Du81XPkPOHQ,2427959464645161.5
EASY Scalping Strategy For Daytrading Forex (High Winrate Strategy),Data Trader,476000,1455210,2111,https://www.youtube.com/watch?v=D80KULtCbHw,156189323050686.88
Catch 500 PIPS in GOLD with 99% Winning Strategy | SIMPLE TRADING SETUP - XAUUSD &amp; FOREX by Paras,The Novel Trading,2030,1621,16,https://www.youtube.com/watch?v=ni0Fk6fsstk,417498681.25
The Only 5minutes GOLD Trading Strategy You Will Ever Need,ForexWizard,45200,36445,39,https://www.youtube.com/watch?v=xGrHuoWBrjw,1909194687179.487
Strategy of the Month: The Winner is a Multiday Reversal on Gold with a Fantastic Equity Curve!,Unger Academy USA,9550,1060,1,https://www.youtube.com/watch?v=RvnHgkIC1Mg,96674650000.0
The ONLY FOREX Trading Strategy You Will EVER Need,RockzFX Academy,344000,629952,384,https://www.youtube.com/watch?v=gshCo9rLMpI,194130208000000.0
Stacking Fractional Gold is a Winning Strategy,Florida Stacker,23000,9368,114,https://www.youtube.com/watch?v=010nvbscu-k,43470807017.54387
Revealing My Ultimate Gold Trading Strategy,Kommon Forex,13100,40648,87,https://www.youtube.com/watch?v=8Fr7YVKXfcg,80179348045.977
After 8 Years Trading This Is My Favorite Strategy - Best Way To Trade Consistently And Profitably,Trade Pro,215000,687629,1057,https://www.youtube.com/watch?v=1FdgVZX55AY,30071570979186.38
Best Gold Trading Strategy With 83% Winrate! (Insane Accuracy),Faiz SMC,128000,43592,265,https://www.youtube.com/watch?v=rXUDahzLjZM,2695137086792.4526
[Free Webinar] Investing In Gold - Winning Strategy For Investing In Gold,Michael Emberson,1330,2290,0,https://www.youtube.com/watch?v=cMT_YUoFVLo,inf
The BEST Forex Trading Strategy for Gold *LIVE TRADING XAU/USD*,Jooviers Gems,535000,72923,178,https://www.youtube.com/watch?v=vJvlj3NkmtM,117260593679775.28
Simple Gold Scalping Strategy | This Will Change Your Game | 98% Win Rate Gold Scalping,Trading Yoda,932,1814,6,https://www.youtube.com/watch?v=uKo32QPkEfY,262613989.3333333
This SIMPLE Trading Strategy Has A 88.89% Winning Rate,Rayner Teo,1980000,1745361,1605,https://www.youtube.com/watch?v=W8ENIXvcGlQ,4263248139813083.5
🤯 The craziest strategy secures gold!🥇| Women&#39;s Short Track Speed Skating 1500m Final | #Gangwon2024,Olympics,14300000,2356298,1323,https://www.youtube.com/watch?v=Qgl1GITk0Js,3.642020997883598e+17
Gold Tactics: The Winning Strategy of the USWNT,Busy Watching Women's Soccer,1640,4996,119,https://www.youtube.com/watch?v=PcjFrAaOrlo,112917996.63865547
A Winning Strategy For Stacking Silver And Gold in 2023,Stackers University,8630,7435,211,https://www.youtube.com/watch?v=urEC6iTPSgA,2624340054.5023694
Strategy of the Month: The Winner is an Intraday Breakout on Gold with an Excellent Equity Line!,Unger Academy USA,9550,1076,2,https://www.youtube.com/watch?v=eWRXL1d87oo,49066945000.0
Forex trading Strategy 100% winning trades!! WIN every trade you take!!!,Rafal Zuchowicz,43000,1042942,3762,https://www.youtube.com/watch?v=JzN1fEZmc40,512599616693.2482
How I Increased My Win Rate Using Supply and Demand Strategy | FOREX,Doyle Exchange,142000,167518,347,https://www.youtube.com/watch?v=lPntY5C0SvU,9734388910662.824
The Only GOLD 15min Day Trading Strategy You Will Ever Need,ForexWizard,45200,81076,132,https://www.youtube.com/watch?v=Yj6vDKTVvM4,1254859932121.2122
"Turning $100 to $ 1,00,000 Day Forex trading market || Auto trading Bot",Forex Algo EA,5370,485870,0,https://www.youtube.com/watch?v=WqmDTJ9kUwo,inf
THE BEST FOREX TRADING STRATEGY | KEEP IT SIMPLE,Trade Forex with Paul,28500,419967,946,https://www.youtube.com/watch?v=LwGp9YH7H-g,360590058932.34674
95% WIN ]GOLD Scalping Strategy Back tested 100x #goldtrading #xauusdforex,LadyTraders Fx,41,450,0,https://www.youtube.com/watch?v=T-kzbSm2Ps0,inf
5 Minute Scalping Strategy **HIGHEST WIN RATE**,The Moving Average,958000,2510152,2243,https://www.youtube.com/watch?v=wbfXaqjIrJ0,1027074070498439.6
• Forex Gold Trading Strategy Live | Forex Gold Live Trading Tutorial 2022,Precious Pips,4790,337105,284,https://www.youtube.com/watch?v=kY4jOziglF0,27234404332.746475
New York Session Scalping Strategy: Trading Nasdaq with High Winrate @themas7er,The Trading Guide,35800,52837,95,https://www.youtube.com/watch?v=Kllt34r-lRg,712821186105.2632
